ID,SITECODE,SITENAME,GNIS_NAME,Mismatch,lat,lon,StationName,COMID,Comment,July.Q.mn,August.Q.mn,July.Q.md,August.Q.md
T10129500,USGS10129500,USGS10129500,Weber River,usgs,40.79306904,-111.4051051,"WEBER RIVER NEAR WANSHIP, UT",10093078,prox impoundment,234.4977531,133.5334951,216.6962635,123.2132137
T10129900,USGS10129900,"Silver Creek near Atkinson, UT",Silver Creek,NA,40.73522634,-111.4760313,"SILVER CREEK NEAR SILVER CREEK JUNCTION, UT",10093082,suburban,5.075724612,3.22864738,3.953555294,2.799404825
T10130500,USGS10130500,USGS10130500,Weber River,usgs,40.89531988,-111.4014929,"WEBER RIVER NEAR COALVILLE, UT",10092262,"irrigated agric, impoundment",196.3150267,150.6766587,179.9454135,142.4705653
T10133800,USGS10133800,E Canyon Ck ab E. Canyon WWTP,East Canyon Creek,NA,40.75609683,-111.5637585,"EAST CANYON CREEK NEAR JEREMY RANCH, UT",10276836,suburban,23.73353639,13.46013232,19.95457952,12.87682893
T10133980,USGS10133980,EAST CANYON CREEK AB EAST CYN,East Canyon Creek,NA,40.8707044,-111.5848922,"EAST CANYON CREEK AB EAST CYN RES NR MORGAN, UTAH",10276712,suburban,30.21701198,25.44626299,24.58643425,23.61959263
T10141000,USGS10141000,WEBER RIVER,Weber River,NA,41.27813959,-112.0918407,"WEBER RIVER NEAR PLAIN CITY, UT",10273232,irrigated agric,640.6086689,492.2393459,557.7119942,496.062257
T10167700,USGS10167700,USGS10167700,Little Cottonwood Creek,usgs,40.60777087,-111.832352,"LITTLE COTTONWOOD CREEK @ 2050 EAST NR SLC, UT",10390274,prox urban,80.67602459,36.85426423,75.97719617,33.93536024
T10167800,USGS10167800,USGS10167800,Little Cottonwood Creek,usgs,40.61461226,-111.8426507,LITTLE COTTONWOOD CREEK @ CRESTWOOD PARK @ SLC,10390274,prox urban,80.67602459,36.85426423,75.97719617,33.93536024
T10168000,USGS10168000,Little Cottonwood @ Jordan Riv,Little Cottonwood Creek,NA,40.66492783,-111.9016686,LITTLE COTTONWOOD CREEK @ JORDAN RIVER NR SLC,10389562,prox urban,74.37723557,38.24743391,75.26301918,36.36371639
T10171000,USGS10171000,JORDAN RIVER,Jordan River,NA,40.73359483,-111.9234986,"JORDAN RIVER @ 1700 SOUTH @ SALT LAKE CITY, UT",10390290,suburban,890.7782312,817.6767188,761.920146,817.0095245
T10172200,USGS10172200,RED BUTTE CR,Emigration Creek,m,40.7799403,-111.8057447,"RED BUTTE CREEK AT FORT DOUGLAS, NEAR SLC, UT",NA,PLD,NA,NA,NA,NA
T10243228,USGS10243228,S FK BIG WASH ABV GREAT BSN NA,South Fork Big Wash,NA,38.88381275,-114.1884532,S FK BIG WASH ABV GREAT BSN NAT PK BDY NR BAKER NV,10409540,PLD,4.897296098,2.4884615,4.26639929,2.30648418
T10243230,USGS10243230,SNAKE CK ABV PIPELINE NR BAKER,Snake Creek,NA,38.92116749,-114.2243797,"SNAKE CK ABV PIPELINE NR BAKER, NV",10408872,PLD,11.00401136,5.5007911,9.68209987,4.650945156
T10243233,USGS10243233,SNAKE CK BLW SPGS CK NR GARRIS,Snake Creek,NA,38.91844855,-114.101073,"SNAKE CK BLW SPRING CK NR GARRISON, UT",10408868,PLD,7.368988866,6.25904328,7.534260287,5.930525145
T10243234,USGS10243234,SNAKE CK AT NV-UT STATE LINE N,Snake Creek,NA,38.92993127,-114.0494878,"SNAKE CK AT NV-UT STATE LINE NR GARRISON, UT",10408868,PLD,7.368988866,6.25904328,7.534260287,5.930525145
T10243240,USGS10243240,USGS10243240,NA,usgs,38.99080924,-114.206238,"BAKER CK AT NARROWS NR BAKER, NV",10408834,PLD,18.98704403,9.666253858,16.14658358,7.876213478
T10243260,USGS10243260,USGS10243260,NA,usgs,39.01161292,-114.2144392,"LEHMAN CK NR BAKER, NV",10407562,PLD,12.85031982,7.296010746,9.900998076,5.80964646
T10243280,USGS10243280,STRAWBERRY CK ABV GREAT BSN NA,Strawberry Creek,NA,39.06420396,-114.2586226,STRAWBERRY CK ABV GREAT BSN NAT PK BDY NR BAKER NV,10408164,PLD,5.606519175,2.720239069,4.514136165,2.298691981
T10243630,USGS10243630,WILLIAMS CYN ABV AQUEDUCT NR M,NA,x,38.94536167,-114.3589995,"WILLIAMS CYN ABV AQUEDUCT NR MINERVA, NV",NA,PLD,NA,NA,NA,NA
T10243640,USGS10243640,SHINGLE CK NR GREAT BSN NAT PK,NA,x,39.0054973,-114.3605912,"SHINGLE CK NR GREAT BSN NAT PK BDY NR OSCEOLA, NV",NA,PLD,NA,NA,NA,NA
T10291500,USGS10291500,USGS10291500,Buckeye Creek,usgs,38.23880787,-119.3259923,"BUCKEYE CK NR BRIDGEPORT, CA",8915907,PLD,119.1014996,49.20865976,103.3601877,44.66855996
T10309000,USGS10309000,USGS10309000,East Fork Carson River,usgs,38.84450743,-119.7039922,"E FK CARSON RV NR GARDNERVILLE, NV",8922339,PLD,401.6854769,155.591371,258.8839477,111.5030514
T10313400,USGS10313400,MARYS RIVER,Marys River,NA,41.54991275,-115.3067288,"MARYS RV BLW ORANGE BRG NR CHARLESTON, NV",10772174,PLD,20.40910154,2.949702071,17.88847035,1.869228188
T10315600,USGS10315600,USGS10315600,Marys River,usgs,41.1542192,-115.2715344,"MARYS RV BLW TWIN BUTTES NR DEETH, NV",10777342,PLD,47.46748025,24.73669195,38.01013159,20.59335523
T10333000,USGS10333000,"HUMBOLDT RV NR IMLAY, NV",Humboldt River,NA,40.69240481,-118.2043121,"HUMBOLDT RV NR IMLAY, NV",11153151,"upstrm irrigated agric, suburban",489.2400634,479.1460925,378.4034992,390.6486743
T10335000,USGS10335000,USGS10335000,Humboldt River,usgs,40.46741523,-118.3073708,"HUMBOLDT RV NR RYE PATCH, NV",11157297,prox impoundment,469.8907476,471.7760413,366.8344315,379.388075
T10336000,USGS10336000,"HUMBOLDT RV NR LOVELOCK, NV",Humboldt River,NA,40.05204585,-118.4676606,"HUMBOLDT RV NR LOVELOCK, NV",11158333,"upstrm irrigated agric, impoundment",474.5233325,530.0065254,382.2417816,435.3699071
T10336580,USGS10336580,USGS10336580,Upper Truckee River,usgs,38.79629598,-120.0190718,UPPER TRUCKEE RV AT S UPPER TRUCKEE RD NR MEYERS,8943705,PLD,39.58316382,9.104482551,18.21478631,4.860611882
T10336593,USGS10336593,USGS10336593,Grass Lake Creek,usgs,38.80185155,-120.0160162,GRASS LK C NR MEYERS CA,8943703,PLD,13.39440363,5.039892464,7.46783142,3.43804425
T103366092,USGS103366092,USGS103366092,Upper Truckee River,usgs,38.84851852,-120.0271275,"UPPER TRUCKEE RV AT HWY 50 ABV MEYERS, CA",8943677,prox suburban,82.37532312,18.88135891,42.48305144,12.44491111
T103366098,USGS103366098,UPPER TRUCKEE RV AT HWY 50 BRG,Upper Truckee River,NA,38.87524177,-120.0054063,"UPPER TRUCKEE RV AT HWY 50 BRG BLW MEYERS, CA",8943613,prox suburban,83.19691278,21.81666545,43.25580532,14.4736953
T10336610,USGS10336610,USGS10336610,Upper Truckee River,usgs,38.92263956,-119.9913833,"UPPER TRUCKEE RV AT SOUTH LAKE TAHOE, CA",8944439,prox suburban,80.2409878,21.98533171,38.45478816,14.9263625
T10336612,USGS10336612,UPPER TRUCKEE RV A MOUTH NR VE,Upper Truckee River,NA,38.9337196,-119.9961792,"UPPER TRUCKEE RV A MOUTH NR VENICE DRIVE, CA",8945209,prox suburban,77.63164554,21.95504724,38.29603407,15.22642723
T10336700,USGS10336700,USGS10336700,Incline Creek,usgs,39.2401855,-119.9449106,"INCLINE CK NR CRYSTAL BAY, NV",8942879,prox suburban,6.39488097,3.288059261,3.425645247,2.054257584
T10336730,USGS10336730,USGS10336730,NA,usgs,39.08796735,-119.9402249,"GLENBROOK CK AT GLENBROOK, NV",8942501,PLD,1.448000516,0.474999781,1.095437435,0.375463402
T103367592,USGS103367592,USGS103367592,NA,usgs,38.95657448,-119.9276805,"EAGLE ROCK CK NR STATELINE, NV",8944415,PLD,0.509605337,0.160786624,0.370375829,0.128278107
T10336770,USGS10336770,USGS10336770,Trout Creek,usgs,38.86314464,-119.9584837,"TROUT CK AT USFS RD 12N01 NR MEYERS, CA",8944527,PLD,13.2222828,6.579285291,7.266569574,5.169136917
T10336775,USGS10336775,USGS10336775,Trout Creek,usgs,38.90339444,-119.9688917,"TROUT CK AT PIONEER TRAIL NR SOUTH LAKE TAHOE, CA",8944479,PLD,27.92219888,10.19843802,11.15561963,6.365121947
T10336779,USGS10336779,"COLD CK AT MOUTH, CA",Cold Creek,NA,38.91185162,-119.9700834,"COLD CK AT MOUTH, CA",8944455,PLD,15.85151188,7.463191066,8.842650676,5.525733664
T10336780,USGS10336780,"TROUT CK NR TAHOE VALLEY, CA",Trout Creek,NA,38.9199213,-119.9726868,"TROUT CK NR TAHOE VALLEY, CA",8944453,PLD,43.51744562,18.12146429,20.33953076,11.70325656
T10336790,USGS10336790,USGS10336790,Trout Creek,usgs,38.93199644,-119.9791896,TROUT C A SOUTH LAKE TAHOE CA,8945207,prox suburban,46.21123847,20.13903711,21.8488778,14.30386983
T10336795,USGS10336795,USGS10336795,Trout Creek,usgs,38.93594181,-119.9916769,"TROUT CK NR MOUTH E NR BELLEVUE/ELDORADO AVE, CA",8945205,prox suburban,46.09164442,20.0842589,21.85745715,14.34232344
T10348200,USGS10348200,TRUCKEE R NR,NA,x,39.52273277,-119.7371175,"TRUCKEE RV NR SPARKS, NV",8932654,prox urban,954.9676551,312.2998684,616.0580794,249.924019
T10350500,USGS10350500,TRUCKEE R AT,Truckee River,NA,39.56556565,-119.4857292,"TRUCKEE RV AT CLARK, NV",8931816,upstrm urban,1027.005333,527.7192032,807.6523904,465.8831643
T10351600,USGS10351600,"TRUCKEE RV AT DERBY DAM, NV",Truckee River,NA,39.5853534,-119.4472027,"TRUCKEE RV BLW DERBY DAM NR WADSWORTH, NV",8931712,"prox impoundment, upstrm urban",1039.787739,531.0308398,810.5356428,470.0728818
T10351650,USGS10351650,USGS10351650,Truckee River,usgs,39.63226161,-119.2829076,"TRUCKEE RV AT WADSWORTH, NV",11313919,"upstrm irrigated agric, urban",1098.912533,580.4375448,911.5230483,538.0967527
T10351700,USGS10351700,TRUCKEE R NR,Truckee River,NA,39.77792713,-119.3376817,"TRUCKEE RV NR NIXON, NV",11314309,"upstrm irrigated agric, urban",1264.452415,698.0307898,1055.287529,652.5338804
T11046062,USGS11046062,COCKLEBURR C LAGOON A MOUTH NR,NA,x,33.25090549,-117.431341,COCKLEBURR C LAGOON A MOUTH NR OCEANSIDE CA,20351115,prox suburban,0,0,0,0
T11060400,USGS11060400,WARM C NR SAN BERNARDINO CA,NA,x,34.0781944,-117.3006493,WARM C NR SAN BERNARDINO CA,22557922,urban,18.86147193,10.45555506,10.97552996,5.858824846
T11066460,USGS11066460,USGS11066460,Santa Ana River,usgs,33.96845815,-117.4485354,SANTA ANA R A MWD CROSSING CA,22563032,urban,47.20892243,52.89820158,23.1923609,29.95634469
T11073495,USGS11073495,USGS11073495,NA,usgs,33.98279122,-117.5994966,CUCAMONGA C NR MIRA LOMA CA,22563070,"prox irrigated agric, suburban",2.638026575,2.120897715,0.827960491,1.223859842
T11128500,USGS11128500,USGS11128500,Santa Ynez River,usgs,34.58474153,-120.1446996,SANTA YNEZ R A SOLVANG CA,17609015,"upstrm suburban, irrigated agric, impoundment",20.96820886,9.922983954,11.83354209,4.65408706
T11133000,USGS11133000,USGS11133000,Santa Ynez River,usgs,34.63717488,-120.4251136,SANTA YNEZ R A NARROWS NR LOMPOC CA,948060325,"irrigated agric, suburban",24.60382128,11.53237932,15.18099676,5.864099891
T11173575,USGS11173575,USGS11173575,Alameda Creek,usgs,37.54020702,-121.8572982,ALAMEDA C BL WELCH C NR SUNOL CA,2806865,upstrm impoundment,3.729185114,1.759979513,2.254147492,1.131875841
T11176900,USGS11176900,USGS11176900,Arroyo de la Laguna,usgs,37.62655759,-121.8826747,ARROYO DE LA LAGUNA A VERONA CA,2806611,upstrm urban,1.683248425,0.933173838,0.486498035,0.571848787
T11179000,USGS11179000,USGS11179000,Alameda Creek,usgs,37.58694355,-121.9607628,ALAMEDA C NR NILES CA,2806725,upstrm impoundment,4.522689055,2.497299656,1.791321578,1.352257336
T11261100,USGS11261100,SALT SLOUGH A HWY 165 NR STEVI,Salt Slough,NA,37.25518653,-120.8627062,SALT SLOUGH A HWY 165 NR STEVINSON CA,19777307,upstrm irrigated agric,0.915353628,2.100449797,0.707843103,1.994769203
T11261500,USGS11261500,SAN JOAQUIN,San Joaquin River,NA,37.30975579,-120.930453,SAN JOAQUIN R A FREMONT FORD BRIDGE CA,19771455,prox irrigated agric,880.2649825,1796.007843,887.7603299,1954.020945
T11274538,USGS11274538,ORESTIMBA CR,Orestimba Creek,NA,37.41354657,-121.0160412,ORESTIMBA CR AT RIVER RD NR CROWS LANDING CA,2827158,prox irrigated agric,0.162303086,0.111431742,0,0.102926409
T11274550,USGS11274550,SAN JOAQUIN R NR CROWS LANDING,San Joaquin River,NA,37.432255,-121.0144879,SAN JOAQUIN R NR CROWS LANDING CA,2828044,prox irrigated agric,964.6875194,2066.530874,926.7977457,2353.848634
T11290000,USGS11290000,TUOLUMNE R A,Tuolumne River,NA,37.62752564,-120.9869274,TUOLUMNE R A MODESTO CA,2823972,prox urban,1832.426866,904.6055219,1688.002724,791.219422
T11446220,USGS11446220,USGS11446220,NA,usgs,38.70394317,-121.1644015,AMERICAN R BL FOLSOM DAM NR FOLSOM CA,15022453,prox impoundment,1498.936699,748.8467266,1221.19706,672.9381125
T11447650,USGS11447650,SACRAMENTO R,Sacramento River,NA,38.45599521,-121.5017981,SACRAMENTO R A FREEPORT CA,15048349,"prox irrigated agric, urban",13221.82936,7325.84427,11545.11586,6970.301698
T11467000,USGS11467000,USGS11467000,Russian River,usgs,38.50813359,-122.9274567,RUSSIAN R A HACIENDA BRIDGE NR GUERNEVILLE CA,8272725,"upstrm irrigated agric, suburban",111.2824809,61.1401644,70.89448768,42.55147819
T11468010,USGS11468010,USGS11468010,Albion River,usgs,39.26014257,-123.6179889,ALBION R NR COMPTCHE CA,2664251,PLD,2.217256055,0.955575735,2.006872226,0.839246568
T11468070,USGS11468070,USGS11468070,South Fork Big River,usgs,39.2301424,-123.4655578,SF BIG R NR COMPTCHE CA,2664341,PLD,3.78150445,2.121390707,2.880431907,1.76209292
T11468092,USGS11468092,USGS11468092,Big River,usgs,39.3180981,-123.6146282,BIG R BLW TWO LOG CR NR COMPTCHE CA,2664095,PLD,17.59952705,9.890260669,13.62038311,8.766854453
T11468900,USGS11468900,USGS11468900,Mattole River,usgs,40.13967649,-123.9911179,MATTOLE R NR ETTERSBURG CA,2546355,PLD,22.26623022,10.66884881,17.5925452,8.566766186
T11497500,USGS11497500,"SPRAGUE RIVER NEAR BEATTY, OR",Sprague River,NA,42.44738201,-121.2385787,"SPRAGUE RIVER NEAR BEATTY, OR",24084452,prox irrigated agric,71.70533918,97.91996,56.43820774,80.29901497
T11501000,USGS11501000,"SPRAGUE RIVER NEAR CHILOQUIN,*",Sprague River,NA,42.58451331,-121.8502018,"SPRAGUE RIVER NEAR CHILOQUIN, OR",24084310,upstrm irrigated agric,215.0521362,328.1209556,180.3300827,275.8949463
T11502500,USGS11502500,USGS11502500,Williamson River,usgs,42.56447521,-121.8798108,"WILLIAMSON RIVER BLW SPRAGUE RIVER NR CHILOQUIN,OR",24082481,PLD,610.2790703,657.312611,514.09731,542.1829333
T11507500,USGS11507500,"LINK RIVER BELOW KENO CANAL, N",Link River,NA,42.21932845,-121.7903286,"LINK RIVER AT KLAMATH FALLS, OR",2553629,prox impoundment,1162.600148,1077.380537,946.1948672,863.4029007
T11507501,USGS11507501,"LINK RIVER BELOW KENO CANAL, N",Link River,NA,42.21931141,-121.7902816,"LINK RIVER BELOW KENO CANAL, NEAR KLAMATH FALLS,OR",2553629,prox impoundment,1162.600148,1077.380537,946.1948672,863.4029007
T11509370,USGS11509370,"KLAMATH RIVER ABOVE KENO DAM,",Klamath River,NA,42.12792225,-121.9288964,"KLAMATH RIVER ABOVE KENO DAM, AT KENO, OR",2553639,impoundment,1376.050752,1594.730877,1196.415064,1318.308461
T11509500,USGS11509500,USGS11509500,Klamath River,usgs,42.13323334,-121.961506,"KLAMATH RIVER AT KENO, OR",359943,prox impoundment,1389.550184,1611.531581,1202.31513,1326.958656
T11510700,USGS11510700,USGS11510700,Klamath River,usgs,42.0846654,-122.0731274,"KLAMATH RIVER BLW JOHN C.BOYLE PWRPLNT, NR KENO,OR",358949,upstrm impoundment,1505.112733,1693.782018,1329.75587,1394.428951
T11517000,USGS11517000,USGS11517000,Shasta River,usgs,41.70912158,-122.5385279,SHASTA R NR  MONTAGUE CA,3917252,prox irrigated agric,217.9460884,224.7644226,197.2550418,208.0783275
T11530500,USGS11530500,USGS11530500,Klamath River,usgs,41.51451216,-124.0013283,KLAMATH R NR KLAMATH CA,4440630,upstrm impoundment,7049.592739,5043.879268,6581.030987,4821.440367
T12044900,USGS12044900,USGS12044900,Elwha River,usgs,47.97029527,-123.5908452,"ELWHA RIVER ABOVE LAKE MILLS NR PORT ANGELES, WA",23997160,PLD,1053.238521,663.3722783,1001.237229,634.5300895
T12045500,USGS12045500,ELWHA RIVER,Elwha River,NA,48.05518032,-123.5837588,"ELWHA RIVER AT MCDONALD BR NEAR PORT ANGELES, WA",23997080,PLD,1414.009551,761.9680311,1283.763554,740.0270696
T12046260,USGS12046260,ELWHA RIVER AT DIVERSION NEAR,Elwha River,NA,48.11176847,-123.5525594,"ELWHA RIVER AT DIVERSION NEAR PORT ANGELES, WA",23997046,PLD,1188.168298,725.854106,1042.960145,678.3758196
T12048000,USGS12048000,"DUNGENESS RIVER NEAR SEQUIM, *",Dungeness River,NA,48.01425781,-123.1326773,"DUNGENESS RIVER NEAR SEQUIM, WA",23997388,PLD,493.9238049,259.4244077,466.8191452,234.6539954
T12048550,USGS12048550,USGS12048550,Dungeness River,usgs,48.06175851,-123.154067,"DUNGENESS RIVER AT DUNGENESS MDWS NR CARLSBORG, WA",23997372,PLD,537.7705041,278.4453307,527.5403211,266.9996717
T12049000,USGS12049000,USGS12049000,Dungeness River,usgs,48.14404758,-123.128418,"DUNGENESS RIVER AT DUNGENESS, WA",23997334,PLD,563.4259431,302.0161558,568.4543082,292.9309418
T12056500,USGS12056500,NF SKOKOMISH,North Fork Skokomish River,NA,47.51405524,-123.3302004,"NF SKOKOMISH R BL STAIRCASE RPDS NR HOODSPORT, WA",24285534,PLD,315.5591048,150.5588766,277.5159699,127.9465715
T12058800,USGS12058800,USGS12058800,North Fork Skokomish River,usgs,47.39017123,-123.2096272,"NF SKOKOMISH R BL LWR CUSHMAN DAM NR POTLATCH, WA",24285508,prox impoundment,414.5776278,204.3536398,417.8631148,195.3215662
T12065008,USGS12065008,MISSION CREEK AT MISSION CREEK,Mission Creek,NA,47.4362717,-122.875474,"MISSION CREEK AT MISSION CREEK ROAD NR BELFAIR, WA",24287226,PLD,8.865865172,8.597186525,8.750649279,8.58302695
T12069550,USGS12069550,USGS12069550,Big Beef Creek,usgs,47.64064868,-122.7851527,"BIG BEEF CREEK NEAR SEABECK, WA",24287296,PLD,10.0006841,9.265509895,9.758162121,9.174158822
T12070000,USGS12070000,"DOGFISH CREEK NEAR POULSBO, WA",NA,x,47.75244259,-122.6444499,"DOGFISH CREEK NEAR POULSBO, WA",23989045,prox suburban,3.043315461,3.388893221,2.995019392,3.378572195
T12070600,USGS12070600,UNNAMED TRIBUTARY TO DYES INLE,NA,x,47.65009406,-122.7007039,"UNNAMED TRIBUTARY TO DYES INLET NR SILVERDALE, WA",23990251,suburban,1.337268751,1.237349325,1.303185136,1.219264299
T12072380,USGS12072380,"GORST CREEK NEAR GORST, WA",Gorst Creek,NA,47.52715675,-122.7056293,"GORST CREEK NEAR GORST, WA",23989105,suburban,5.484731202,4.845162603,5.26405719,4.747069238
T12072660,USGS12072660,OLALLA CREEK AT BURLEY OLALLA,Olalla Creek,NA,47.43148577,-122.5759651,"OLALLA CREEK AT BURLEY OLALLA ROAD NEAR OLALLA, WA",23989151,PLD,3.647138523,3.210386779,3.49456069,3.115371333
T12073520,USGS12073520,"MINTER CREEK NEAR MINTER, WA",Minter Creek,NA,47.38037322,-122.700135,"MINTER CREEK NEAR MINTER, WA",23989199,PLD,12.06539641,10.7894447,11.58461833,10.58664552
T12073895,USGS12073895,"COULTER CREEK NEAR ALLYN, WA",Coulter Creek,NA,47.40842768,-122.8170861,"COULTER CREEK NEAR ALLYN, WA",23989249,PLD,9.41326379,8.731548541,9.103838808,8.598161614
T12080800,USGS12080800,WOODLAND CREEK BELOW DURHAM RO,Woodland Creek,NA,47.06342958,-122.8084687,"WOODLAND CREEK BELOW DRAHAM ROAD NEAR LACEY, WA",23989405,suburban,14.5992711,12.40000789,14.09631744,12.21097654
T12090452,USGS12090452,SPANAWAY CR AT SPANAWAY LK OUT,NA,x,47.1222398,-122.4464818,"SPANAWAY CR AT SPANAWAY LK OUTLET NR SPANAWAY, WA",23989487,lake outlet,11.67954416,12.54971474,11.35812954,12.51796497
T12091100,USGS12091100,USGS12091100,Flett Creek,usgs,47.1894983,-122.5203074,"FLETT CREEK AT TACOMA, WA",23990667,suburban,5.240046332,6.631741202,5.084849889,6.568022202
T12102000,USGS12102000,USGS12102000,Clarks Creek,usgs,47.17738905,-122.3169939,"CLARKS CREEK AT PUYALLUP, WA",23981667,spring,7.518030183,9.331047537,7.233951567,9.18815278
T12102212,USGS12102212,USGS12102212,Swam Creek,usgs,47.22843292,-122.3917891,"SWAN CREEK AT PIONEER WAY TACOMA, WA",23981471,suburban,1.632075853,2.145892783,1.590312588,2.111801551
T12102990,USGS12102990,UNNAMED TRIBUTARY TO WEST HYLE,NA,x,47.2798223,-122.319844,"UNNAMED TRIBUTARY TO WEST HYLEBOS CR NR MILTON, WA",23990583,urban,0.752510899,0.925576821,0.722719863,0.905961816
T12112600,USGS12112600,BIG SOOS CREEK ABOVE HATCHERY,Big Soos Creek,NA,47.31237121,-122.1658587,"BIG SOOS CREEK ABOVE HATCHERY NEAR AUBURN, WA",23977806,suburban,51.64934125,39.25756412,49.99586416,37.90355852
T12113349,USGS12113349,USGS12113349,Green River,usgs,47.4399299,-122.2461125,"MILL CREEK NEAR MOUTH AT ORILLIA, WA",NA,urban,NA,NA,NA,NA
T12113390,USGS12113390,USGS12113390,Duwamish River,usgs,47.47869704,-122.2585684,"DUWAMISH RIVER AT GOLF COURSE AT TUKWILA, WA",23977620,urban,673.2581006,394.3283508,638.6845295,402.1576666
T12115000,USGS12115000,USGS12115000,Cedar River,usgs,47.36964057,-121.6254201,"CEDAR RIVER NEAR CEDAR FALLS, WA",24537996,PLD,161.9180047,82.32901702,144.3063899,79.54031947
T12116500,USGS12116500,USGS12116500,Cedar River,usgs,47.41576174,-121.7906387,"CEDAR RIVER AT CEDAR FALLS, WA",24537944,prox impoundment,282.856172,150.0015774,249.0083471,141.0273764
T12117000,USGS12117000,"TAYLOR CREEK NEAR SELLECK, WA",Taylor Creek,NA,47.3865302,-121.8465761,"TAYLOR CREEK NEAR SELLECK, WA",24537924,PLD,47.44079909,30.72601825,44.03512039,29.91282935
T12117600,USGS12117600,USGS12117600,Cedar River,usgs,47.37952505,-121.9836619,"CEDAR RIVER BELOW DIVERSION NEAR LANDSBURG, WA",24537920,prox diversion,393.2286759,228.6404138,372.4800068,225.3928185
T12117695,USGS12117695,ROCK CREEK AT CEDAR FALLS ROAD,Rock Creek,NA,47.40336676,-121.8994033,"ROCK CREEK AT CEDAR FALLS ROAD NEAR LANDSBURG, WA",947110254,PLD,5.668774115,3.673189885,5.273876981,3.503971864
T12119000,USGS12119000,CEDAR RIVER,Cedar River,NA,47.48259993,-122.2034547,"CEDAR RIVER AT RENTON, WA",24537890,prox urban,389.8810508,265.7193093,376.4875438,262.942095
T12119600,USGS12119600,USGS12119600,May Creek,usgs,47.52982191,-122.2012331,"MAY CREEK AT MOUTH NEAR RENTON, WA",24538384,suburban,5.384967919,4.589094483,5.10231533,4.432440931
T12119705,USGS12119705,"COAL CREEK AT BELLEVUE, WA",Coal Creek,NA,47.56843448,-122.1814744,"COAL CREEK AT BELLEVUE, WA",24538362,suburban,2.86064834,2.518623065,2.686097308,2.418885269
T12120003,USGS12120003,STURTEVANT CREEK NEAR 114TH AV,NA,x,47.60696918,-122.1882103,"STURTEVANT CREEK NEAR 114TH AVE SE AT BELLEVUE, WA",24538336,urban,0.658631471,0.63050711,0.647781913,0.625638894
T12120500,USGS12120500,USGS12120500,Juanita Creek,usgs,47.70716917,-122.2148467,"JUANITA CREEK NEAR KIRKLAND, WA",24538278,urban,4.065663644,3.394081532,3.96947513,3.378355791
T12121600,USGS12121600,USGS12121600,Issaquah Creek,usgs,47.55232299,-122.0478975,"ISSAQUAH CREEK NEAR MOUTH NEAR ISSAQUAH, WA",24538078,prox urban,39.05071002,24.21879982,36.68406572,23.09728519
T12125880,USGS12125880,NORTH CREEK NEAR WINTERMUTES C,North Creek,NA,47.83224631,-122.2246949,"NORTH CREEK NEAR WINTERMUTES CORNER, WA",24538122,suburban,6.180178055,6.510643199,6.066054998,6.526242046
T12127100,USGS12127100,USGS12127100,Swamp Creek,usgs,47.75593141,-122.2337368,"SWAMP CREEK AT KENMORE, WA",24538128,suburban,7.726457935,9.108459609,7.667591643,9.145439417
T12128000,USGS12128000,USGS12128000,Thornton Creek,usgs,47.69585578,-122.2759579,"THORNTON CREEK NEAR SEATTLE, WA",24538282,urban,3.432127789,5.142241546,3.337710205,5.070917053
T12128040,USGS12128040,"PIPERS CREEK AT CARKEEK PARK,",Pipers Creek,NA,47.71091729,-122.373949,"PIPERS CREEK AT CARKEEK PARK, AT SEATTLE, WA",23990221,suburban,0.84857532,1.218633878,0.835541867,1.215206597
T12137800,USGS12137800,USGS12137800,Sultan River,usgs,47.9590913,-121.7968229,"SULTAN RIVER BELOW DIVERSION DAM NEAR SULTAN, WA",23963707,prox diversion,438.0044242,203.5586464,402.0990662,202.9151149
T12138160,USGS12138160,USGS12138160,Sultan River,usgs,47.9077857,-121.8154703,"SULTAN RIVER BELOW POWERPLANT NEAR SULTAN, WA",23963701,prox diversion,421.0112702,226.1776201,379.5375397,227.3924072
T12147500,USGS12147500,USGS12147500,North Fork Tolt River,usgs,47.71215004,-121.7884872,"NORTH FORK TOLT RIVER NEAR CARNATION, WA",23970779,PLD,176.1042503,100.3600774,160.1915102,94.53253501
T12147600,USGS12147600,USGS12147600,South Fork Tolt River,usgs,47.70650704,-121.5998684,"SOUTH FORK TOLT RIVER NEAR INDEX, WA",23970773,PLD,32.58733831,13.30841859,27.60710926,11.35374604
T12148000,USGS12148000,USGS12148000,South Fork Tolt River,usgs,47.6895823,-121.7136342,"SOUTH FORK TOLT RIVER NEAR CARNATION, WA",23970763,prox impoundment,84.73588155,41.50100989,75.29731902,37.60968542
T12148300,USGS12148300,USGS12148300,South Fork Tolt River,usgs,47.69676817,-121.7873379,"SF TOLT RIVER BL REGULATING BASIN NR CARNATION, WA",23970759,upstrm impoundment,107.6414953,60.37435936,99.13199876,56.63682634
T12150495,USGS12150495,CHERRY CREEK BELOW MARGARET CR,Cherry Creek,NA,47.74287773,-121.9412324,"CHERRY CREEK BELOW MARGARET CREEK NEAR DUVALL, WA",23970845,PLD,11.24413574,6.201520035,9.726589473,5.968813538
T12155050,USGS12155050,DUBUQUE CREEK BLW PANTHER CREE,Dubuque Creek,NA,47.98777498,-122.0341937,"DUBUQUE CREEK BLW PANTHER CREEK NR LK STEVENS, WA",24279104,suburban,7.006417445,3.419445178,6.595959671,3.286798893
T12178000,USGS12178000,"SKAGIT RIVER AT NEWHALEM, WA",Skagit River,NA,48.67188029,-121.2462216,"SKAGIT RIVER AT NEWHALEM, WA",24255181,upstrm impoundment,NA,NA,NA,NA
T12181000,USGS12181000,SKAGIT RIVER,Skagit River,NA,48.53365918,-121.4292519,"SKAGIT RIVER AT MARBLEMOUNT, WA",24255125,upstrm impoundment,NA,NA,NA,NA
T12205000,USGS12205000,USGS12205000,North Fork Nooksack River,usgs,48.90545852,-121.8448141,"NF NOOKSACK RIVER BL CASCADE CREEK NR GLACIER, WA",23956418,PLD,640.12999,473.4261029,601.7867345,462.6660797
T12208000,USGS12208000,USGS12208000,Middle Fork Nooksack River,usgs,48.77944726,-122.1064122,"MF NOOKSACK RIVER NEAR DEMING, WA",23956170,PLD,368.2721116,227.915306,313.1614331,211.3549247
T12209000,USGS12209000,USGS12209000,South Fork Nooksack River,usgs,48.66427931,-122.1334886,"SF NOOKSACK RIVER NEAR WICKERSHAM, WA",23956010,PLD,411.7276364,202.3058567,349.3759367,186.927141
T12210000,USGS12210000,USGS12210000,South Fork Nooksack River,usgs,48.67771,-122.1656397,"SF NOOKSACK RIVER AT SAXON BRIDGE, WA",23956008,PLD,486.4350533,237.2394388,420.5541531,213.2358923
T12210700,USGS12210700,USGS12210700,Nooksack River,usgs,48.84174545,-122.2939112,"NOOKSACK RIVER AT NORTH CEDARVILLE, WA",23955918,PLD,NA,NA,NA,NA
T12210900,USGS12210900,USGS12210900,Anderson Creek,usgs,48.83364773,-122.3388442,"ANDERSON CREEK AT SMITH ROAD NEAR GOSHEN, WA",23955904,PLD,4.154925493,3.1977655,3.301229502,2.580081195
T12213100,USGS12213100,"NOOKSACK RIVER AT FERNDALE, WA",Nooksack River,NA,48.84465829,-122.5887487,"NOOKSACK RIVER AT FERNDALE, WA",23955772,"intensive agric, suburban",NA,NA,NA,NA
T12301933,USGS12301933,Kootenai River bl Libby Dam nr,Kootenai River,NA,48.4003838,-115.3187218,Kootenai River bl Libby Dam nr Libby MT,22878293,prox impoundment,NA,NA,NA,NA
T12304500,USGS12304500,YAAK RIVER N,Yaak River,NA,48.56188667,-115.9701799,Yaak River near Troy MT,22900496,PLD,NA,NA,NA,NA
